patient_id,gender,race,conditions,medications,procedures
9233763a-9561-4d51-8042-c47479943e08,M,white,"Body mass index 30+ - obesity (finding), Diabetes, Anemia (disorder), Hypertriglyceridemia (disorder), Metabolic syndrome X (disorder), Neuropathy due to type 2 diabetes mellitus (disorder), Diabetic retinopathy associated with type II diabetes mellitus (disorder), Sputum finding (finding), Fatigue (finding), Muscle pain (finding), Joint pain (finding), Chill (finding), Fever (finding), Loss of taste (finding), Suspected COVID-19, COVID-19, Pneumonia (disorder), Hypoxemia (disorder), Respiratory distress (finding), Acute respiratory failure (disorder), Sepsis caused by virus (disorder), Acute deep venous thrombosis (disorder), Septic shock (disorder), Acquired coagulation disorder (disorder), Injury of kidney (disorder), Injury of heart (disorder), Heart failure (disorder), Acute respiratory distress syndrome (disorder)","1 ML Enoxaparin sodium 150 MG/ML Prefilled Syringe, Acetaminophen 500 MG Oral Tablet, vancomycin 1000 MG Injectioilled Syringe, Acetaminophen 500 MG Oral Tablet, 1 ML Enoxaparin sodium 150 MG/ML Prefilled Syringe","Medication Reconciliation (procedure), Face mask (physical object), Plain chest X-ray (procedure), Oxygen administration by mask (procedure), Placing subject in prone position (procedure), Oxygen administration by mask (procedure), Placing subject in prone position (procedure), Oxygen administration by mask (procedure), Placing subject in prone position (procedure), Oxygen administration by mask (procedure), Placing subject in prone position (procedure), Oxygen administration by mask (procedure), Placing subject in prone position (procedure), Oxygen administration by mask (procedure), Placing subject in prone position (procedure), Insertion of endotracheal tube (procedure), Plain chest X-ray (procedure), Controlled ventilation procedure and therapy  initiation and management (procedure), Hemodialysis (procedure), Controlled ventilation procedure and therapy  initiation and management (procedure), Hemodialysis (procedure), Controlled ventilation procedure and therapy  initiation and management (procedure), Hemodialysis (procedure), Controlled ventilation procedure and therapy  initiation and management (procedure), Hemodialysis (procedure), Controlled ventilation procedure and therapy  initiation and management (procedure), Hemodialysis (procedure)"
9768a326-72a3-4552-b3a3-c35f8c0f3f1a,F,white,"Perennial allergic rhinitis, Body mass index 30+ - obesity (finding), Gout, Diabetes, Anemia (disorder), Hypertriglyceridemia (disorder), Metabolic syndrome X (disorder), Cough (finding), Sore throat symptom (finding), Sputum finding (finding), Fever (finding), Suspected COVID-19, COVID-19",Chlorpheniramine Maleate 2 MG/ML Oral Solution,"Intramuscular injection, Medication Reconciliation (procedure), Intramuscular injection, Intramuscular injection, Face mask (physical object), Intramuscular injection"
f90bb497-ea1d-46a6-a047-f450252aa9aa,F,white,"Prediabetes, Anemia (disorder), Miscarriage in first trimester, Chronic sinusitis (disorder), Chronic pain, Cough (finding), Fatigue (finding), Dyspnea (finding), Wheezing (finding), Suspected COVID-19, COVID-19",Vitamin B 12 5 MG/ML Injectable Solution,"Colonoscopy, Medication Reconciliation (procedure), Face mask (physical object)"
23b32b36-8439-4a6e-954e-73035772263f,F,white,"Cough (finding), Fever (finding), Loss of taste (finding), Suspected COVID-19, COVID-19",,"Face mask (physical object), Medication Reconciliation (procedure)"
8de358a3-2fca-411e-897d-48adf02d79f4,F,white,"Seizure disorder, History of single seizure (situation), Brain damage - traumatic, Body mass index 30+ - obesity (finding), Hyperlipidemia, Osteoporosis (disorder), Cough (finding), Dyspnea (finding), Wheezing (finding), Suspected COVID-19, COVID-19, Pneumonia (disorder), Hypoxemia (disorder), Respiratory distress (finding)","Simvastatin 10 MG Oral Tablet, Simvastatin 10 MG Oral Tablet, Simvastatin 10 MG Oral Tablet, Simvastatin 10 MG Oral Tablet, Simvastatin 10 MG Oral Tablet, Simvastatin 10 MG Oral Tablet, Simvastatin 10 MG Oral Tablet, Simvastatin 10 MG Oral Tablet, Simvastatin 10 MG Oral Tablet, Simvastatin 10 MG Oral Tablet, Simvastatin 10 MG Oral Tablet, Simvastatin 10 MG Oral Tablet, Simvastatin 10 MG Oral Tablet, Simvastatin 10 MG Oral Tablet, Simvastatin 10 MG Oral Tablet, Simvastatin 10 MG Oral Tablet, Simvastatin 10 MG Oral Tablet, Simvastatin 10 MG Oral Tablet, Simvastatin 10 MG Oral Tablet, Alendronic acid 10 MG Oral Tablet, Simvastatin 10 MG Oral Tablet, Simvastatin 10 MG Oral Tablet, Simvastatin 10 MG Oral Tablet, Simvastatin 10 MG Oral Tablet, Simvastatin 10 MG Oral Tablet, Simvastatin 10 MG Oral Tablet, 0.4 ML Enoxaparin sodium 100 MG/ML Prefilled Syringe, NDA020503 200 ACTUAT Albuterol 0.09 MG/ACTUAT Metered Dose Inhaler, Acetaminophen 500 MG Oral Tablet","Medication Reconciliation (procedure), Face mask (physical object), Plain chest X-ray (procedure), Oxygen administration by mask (procedure), Placing subject in prone position (procedure), Oxygen administration by mask (procedure), Placing subject in prone position (procedure), Oxygen administration by mask (procedure), Placing subject in prone position (procedure), Oxygen administration by mask (procedure), Placing subject in prone position (procedure), Oxygen administration by mask (procedure), Placing subject in prone position (procedure), Oxygen administration by mask (procedure), Placing subject in prone position (procedure), Oxygen administration by mask (procedure), Placing subject in prone position (procedure), Oxygen administration by mask (procedure), Placing subject in prone position (procedure), Oxygen administration by mask (procedure), Placing subject in prone position (procedure)"
da8a550f-b41a-4d3f-8a17-ba3c43baf4c4,M,asian,"Hypertension, Prediabetes, Anemia (disorder), Diabetes, Hypertriglyceridemia (disorder), Metabolic syndrome X (disorder), Chronic sinusitis (disorder), Diabetic retinopathy associated with type II diabetes mellitus (disorder), Nonproliferative diabetic retinopathy due to type 2 diabetes mellitus (disorder), Macular edema and retinopathy due to type 2 diabetes mellitus (disorder), Neuropathy due to type 2 diabetes mellitus (disorder), Hyperglycemia (disorder), Proliferative diabetic retinopathy due to type II diabetes mellitus (disorder), Chronic kidney disease stage 2 (disorder), Diabetic renal disease (disorder), Microalbuminuria due to type 2 diabetes mellitus (disorder), Dyspnea (finding), Wheezing (finding), Fever (finding), Suspected COVID-19, COVID-19, Pneumonia (disorder), Hypoxemia (disorder), Respiratory distress (finding)","Hydrochlorothiazide 12.5 MG, Hydrochlorothiazide 12.5 MG, Hydrochlorothiazide 12.5 MG, Hydrochlorothiazide 12.5 MG, Hydrochlorothiazide 12.5 MG, Hydrochlorothiazide 12.5 MG, Hydrochlorothiazide 12.5 MG, Hydrochlorothiazide 12.5 MG, Hydrochlorothiazide 12.5 MG, Hydrochlorothiazide 12.5 MG, Hydrochlorothiazide 12.5 MG, Hydrochlorothiazide 12.5 MG, Hydrochlorothiazide 12.5 MG, Hydrochlorothiazide 12.5 MG, Hydrochlorothiazide 12.5 MG, Hydrochlorothiazide 12.5 MG, Hydrochlorothiazide 12.5 MG, Hydrochlorothiazide 12.5 MG, Hydrochlorothiazide 12.5 MG, Hydrochlorothiazide 12.5 MG, Hydrochlorothiazide 12.5 MG, Hydrochlorothiazide 12.5 MG, Hydrochlorothiazide 12.5 MG, Hydrochlorothiazide 12.5 MG, 24 HR Metformin hydrochloride 500 MG Extended Release Oral Tablet, Hydrochlorothiazide 12.5 MG, 24 HR Metformin hydrochloride 500 MG Extended Release Oral Tablet, Hydrochlorothiazide 12.5 MG, 24 HR Metformin hydrochloride 500 MG Extended Release Oral Tablet, Hydrochlorothiazide 12.5 MG, 24 HR Metformin hydrochloride 500 MG Extended Release Oral Tablet, Hydrochlorothiazide 12.5 MG, 24 HR Metformin hydrochloride 500 MG Extended Release Oral Tablet, Hydrochlorothiazide 12.5 MG, 24 HR Metformin hydrochloride 500 MG Extended Release Oral Tablet, Hydrochlorothiazide 12.5 MG, 24 HR Metformin hydrochloride 500 MG Extended Release Oral Tablet, Hydrochlorothiazide 12.5 MG, 24 HR Metformin hydrochloride 500 MG Extended Release Oral Tablet, Hydrochlorothiazide 12.5 MG, 24 HR Metformin hydrochloride 500 MG Extended Release Oral Tablet, Hydrochlorothiazide 12.5 MG, 24 HR Metformin hydrochloride 500 MG Extended Release Oral Tablet, Hydrochlorothiazide 12.5 MG, 24 HR Metformin hydrochloride 500 MG Extended Release Oral Tablet, Hydrochlorothiazide 12.5 MG, 24 HR Metformin hydrochloride 500 MG Extended Release Oral Tablet, Hydrochlorothiazide 12.5 MG, 24 HR Metformin hydrochloride 500 MG Extended Release Oral Tablet, Hydrochlorothiazide 12.5 MG, 24 HR Metformin hydrochloride 500 MG Extended Release Oral Tablet, Hydrochlorothiazide 12.5 MG, 24 HR Metformin hydrochloride 500 MG Extended Release Oral Tablet, Hydrochlorothiazide 12.5 MG, 24 HR Metformin hydrochloride 500 MG Extended Release Oral Tablet, insulin human  isophane 70 UNT/ML / Regular Insulin  Human 30 UNT/ML Injectable Suspension [Humulin], insulin human  isophane 70 UNT/ML / Regular Insulin  Human 30 UNT/ML Injectable Suspension [Humulin], Hydrochlorothiazide 12.5 MG, 24 HR Metformin hydrochloride 500 MG Extended Release Oral Tablet, insulin human  isophane 70 UNT/ML / Regular Insulin  Human 30 UNT/ML Injectable Suspension [Humulin], Hydrochlorothiazide 12.5 MG, 24 HR Metformin hydrochloride 500 MG Extended Release Oral Tablet, insulin human  isophane 70 UNT/ML / Regular Insulin  Human 30 UNT/ML Injectable Suspension [Humulin], Hydrochlorothiazide 12.5 MG, 24 HR Metformin hydrochloride 500 MG Extended Release Oral Tablet, insulin human  isophane 70 UNT/ML / Regular Insulin  Human 30 UNT/ML Injectable Suspension [Humulin], Hydrochlorothiazide 12.5 MG, 24 HR Metformin hydrochloride 500 MG Extended Release Oral Tablet, insulin human  isophane 70 UNT/ML / Regular Insulin  Human 30 UNT/ML Injectable Suspension [Humulin], Hydrochlorothiazide 12.5 MG, 24 HR Metformin hydrochloride 500 MG Extended Release Oral Tablet, insulin human  isophane 70 UNT/ML / Regular Insulin  Human 30 UNT/ML Injectable Suspension [Humulin], Hydrochlorothiazide 12.5 MG, 24 HR Metformin hydrochloride 500 MG Extended Release Oral Tablet, insulin human  isophane 70 UNT/ML / Regular Insulin  Human 30 UNT/ML Injectable Suspension [Humulin], Hydrochlorothiazide 12.5 MG, 24 HR Metformin hydrochloride 500 MG Extended Release Oral Tablet, insulin human  isophane 70 UNT/ML / Regular Insulin  Human 30 UNT/ML Injectable Suspension [Humulin], Hydrochlorothiazide 12.5 MG, 24 HR Metformin hydrochloride 500 MG Extended Release Oral Tablet, insulin human  isophane 70 UNT/ML / Regular Insulin  Human 30 UNT/ML Injectable Suspension [Humulin], Hydrochlorothiazide 12.5 MG, 24 HR Metformin hydrochloride 500 MG Extended Release Oral Tablet, insulin human  isophane 70 UNT/ML / Regular Insulin  Human 30 UNT/ML Injectable Suspension [Humulin], Hydrochlorothiazide 12.5 MG, 24 HR Metformin hydrochloride 500 MG Extended Release Oral Tablet, insulin human  isophane 70 UNT/ML / Regular Insulin  Human 30 UNT/ML Injectable Suspension [Humulin], Hydrochlorothiazide 12.5 MG, 24 HR Metformin hydrochloride 500 MG Extended Release Oral Tablet, insulin human  isophane 70 UNT/ML / Regular Insulin  Human 30 UNT/ML Injectable Suspension [Humulin], Hydrochlorothiazide 12.5 MG, 24 HR Metformin hydrochloride 500 MG Extended Release Oral Tablet, insulin human  isophane 70 UNT/ML / Regular Insulin  Human 30 UNT/ML Injectable Suspension [Humulin], Hydrochlorothiazide 12.5 MG, 24 HR Metformin hydrochloride 500 MG Extended Release Oral Tablet, insulin human  isophane 70 UNT/ML / Regular Insulin  Human 30 UNT/ML Injectable Suspension [Humulin], Hydrochlorothiazide 12.5 MG, 24 HR Metformin hydrochloride 500 MG Extended Release Oral Tablet, insulin human  isophane 70 UNT/ML / Regular Insulin  Human 30 UNT/ML Injectable Suspension [Humulin], Hydrochlorothiazide 12.5 MG, 24 HR Metformin hydrochloride 500 MG Extended Release Oral Tablet, insulin human  isophane 70 UNT/ML / Regular Insulin  Human 30 UNT/ML Injectable Suspension [Humulin], Hydrochlorothiazide 12.5 MG, 24 HR Metformin hydrochloride 500 MG Extended Release Oral Tablet, insulin human  isophane 70 UNT/ML / Regular Insulin  Human 30 UNT/ML Injectable Suspension [Humulin], Hydrochlorothiazide 12.5 MG, 24 HR Metformin hydrochloride 500 MG Extended Release Oral Tablet, insulin human  isophane 70 UNT/ML / Regular Insulin  Human 30 UNT/ML Injectable Suspension [Humulin], Hydrochlorothiazide 12.5 MG, 24 HR Metformin hydrochloride 500 MG Extended Release Oral Tablet, insulin human  isophane 70 UNT/ML / Regular Insulin  Human 30 UNT/ML Injectable Suspension [Humulin], Hydrochlorothiazide 12.5 MG, 24 HR Metformin hydrochloride 500 MG Extended Release Oral Tablet, insulin human  isophane 70 UNT/ML / Regular Insulin  Human 30 UNT/ML Injectable Suspension [Humulin], Hydrochlorothiazide 12.5 MG, 24 HR Metformin hydrochloride 500 MG Extended Release Oral Tablet, insulin human  isophane 70 UNT/ML / Regular Insulin  Human 30 UNT/ML Injectable Suspension [Humulin], Hydrochlorothiazide 12.5 MG, 24 HR Metformin hydrochloride 500 MG Extended Release Oral Tablet, insulin human  isophane 70 UNT/ML / Regular Insulin  Human 30 UNT/ML Injectable Suspension [Humulin], Hydrochlorothiazide 12.5 MG, 24 HR Metformin hydrochloride 500 MG Extended Release Oral Tablet, insulin human  isophane 70 UNT/ML / Regular Insulin  Human 30 UNT/ML Injectable Suspension [Humulin], Hydrochlorothiazide 12.5 MG, 24 HR Metformin hydrochloride 500 MG Extended Release Oral Tablet, insulin human  isophane 70 UNT/ML / Regular Insulin  Human 30 UNT/ML Injectable Suspension [Humulin], Hydrochlorothiazide 12.5 MG, 24 HR Metformin hydrochloride 500 MG Extended Release Oral Tablet, insulin human  isophane 70 UNT/ML / Regular Insulin  Human 30 UNT/ML Injectable Suspension [Humulin], Hydrochlorothiazide 12.5 MG, 24 HR Metformin hydrochloride 500 MG Extended Release Oral Tablet, insulin human  isophane 70 UNT/ML / Regular Insulin  Human 30 UNT/ML Injectable Suspension [Humulin], Hydrochlorothiazide 12.5 MG, 24 HR Metformin hydrochloride 500 MG Extended Release Oral Tablet, insulin human  isophane 70 UNT/ML / Regular Insulin  Human 30 UNT/ML Injectable Suspension [Humulin], Hydrochlorothiazide 12.5 MG, 24 HR Metformin hydrochloride 500 MG Extended Release Oral Tablet, insulin human  isophane 70 UNT/ML / Regular Insulin  Human 30 UNT/ML Injectable Suspension [Humulin], Hydrochlorothiazide 12.5 MG, 24 HR Metformin hydrochloride 500 MG Extended Release Oral Tablet, insulin human  isophane 70 UNT/ML / Regular Insulin  Human 30 UNT/ML Injectable Suspension [Humulin], Hydrochlorothiazide 12.5 MG, 24 HR Metformin hydrochloride 500 MG Extended Release Oral Tablet, insulin human  isophane 70 UNT/ML / Regular Insulin  Human 30 UNT/ML Injectable Suspension [Humulin], Hydrochlorothiazide 12.5 MG, 24 HR Metformin hydrochloride 500 MG Extended Release Oral Tablet, insulin human  isophane 70 UNT/ML / Regular Insulin  Human 30 UNT/ML Injectable Suspension [Humulin], Hydrochlorothiazide 12.5 MG, 24 HR Metformin hydrochloride 500 MG Extended Release Oral Tablet, insulin human  isophane 70 UNT/ML / Regular Insulin  Human 30 UNT/ML Injectable Suspension [Humulin], Hydrochlorothiazide 12.5 MG, 24 HR Metformin hydrochloride 500 MG Extended Release Oral Tablet, insulin human  isophane 70 UNT/ML / Regular Insulin  Human 30 UNT/ML Injectable Suspension [Humulin], Hydrochlorothiazide 12.5 MG, 24 HR Metformin hydrochloride 500 MG Extended Release Oral Tablet, insulin human  isophane 70 UNT/ML / Regular Insulin  Human 30 UNT/ML Injectable Suspension [Humulin], Hydrochlorothiazide 12.5 MG, 24 HR Metformin hydrochloride 500 MG Extended Release Oral Tablet, insulin human  isophane 70 UNT/ML / Regular Insulin  Human 30 UNT/ML Injectable Suspension [Humulin], Hydrochlorothiazide 12.5 MG, 24 HR Metformin hydrochloride 500 MG Extended Release Oral Tablet, insulin human  isophane 70 UNT/ML / Regular Insulin  Human 30 UNT/ML Injectable Suspension [Humulin], Hydrochlorothiazide 12.5 MG, 24 HR Metformin hydrochloride 500 MG Extended Release Oral Tablet, insulin human  isophane 70 UNT/ML / Regular Insulin  Human 30 UNT/ML Injectable Suspension [Humulin], Hydrochlorothiazide 12.5 MG, 24 HR Metformin hydrochloride 500 MG Extended Release Oral Tablet, insulin human  isophane 70 UNT/ML / Regular Insulin  Human 30 UNT/ML Injectable Suspension [Humulin], Hydrochlorothiazide 12.5 MG, 24 HR Metformin hydrochloride 500 MG Extended Release Oral Tablet, insulin human  isophane 70 UNT/ML / Regular Insulin  Human 30 UNT/ML Injectable Suspension [Humulin], Hydrochlorothiazide 12.5 MG, 24 HR Metformin hydrochloride 500 MG Extended Release Oral Tablet, insulin human  isophane 70 UNT/ML / Regular Insulin  Human 30 UNT/ML Injectable Suspension [Humulin], Hydrochlorothiazide 12.5 MG, 24 HR Metformin hydrochloride 500 MG Extended Release Oral Tablet, insulin human  isophane 70 UNT/ML / Regular Insulin  Human 30 UNT/ML Injectable Suspension [Humulin], Hydrochlorothiazide 12.5 MG, 24 HR Metformin hydrochloride 500 MG Extended Release Oral Tablet, insulin human  isophane 70 UNT/ML / Regular Insulin  Human 30 UNT/ML Injectable Suspension [Humulin], Hydrochlorothiazide 12.5 MG, 24 HR Metformin hydrochloride 500 MG Extended Release Oral Tablet, insulin human  isophane 70 UNT/ML / Regular Insulin  Human 30 UNT/ML Injectable Suspension [Humulin], Hydrochlorothiazide 12.5 MG, 24 HR Metformin hydrochloride 500 MG Extended Release Oral Tablet, 0.4 ML Enoxaparin sodium 100 MG/ML Prefilled Syringe, NDA020503 200 ACTUAT Albuterol 0.09 MG/ACTUAT Metered Dose Inhaler, Acetaminophen 500 MG Oral Tablet, insulin human  isophane 70 UNT/ML / Regular Insulin  Human 30 UNT/ML Injectable Suspension [Humulin], Hydrochlorothiazide 12.5 MG, 24 HR Metformin hydrochloride 500 MG Extended Release Oral Tablet, insulin human  isophane 70 UNT/ML / Regular Insulin  Human 30 UNT/ML Injectable Suspension [Humulin], Hydrochlorothiazide 12.5 MG, 24 HR Metformin hydrochloride 500 MG Extended Release Oral Tablet","Medication Reconciliation (procedure), Medication Reconciliation (procedure), Face mask (physical object), Plain chest X-ray (procedure), Oxygen administration by mask (procedure), Placing subject in prone position (procedure), Oxygen administration by mask (procedure), Placing subject in prone position (procedure), Oxygen administration by mask (procedure), Placing subject in prone position (procedure), Oxygen administration by mask (procedure), Placing subject in prone position (procedure), Oxygen administration by mask (procedure), Placing subject in prone position (procedure), Oxygen administration by mask (procedure), Placing subject in prone position (procedure), Oxygen administration by mask (procedure), Placing subject in prone position (procedure), Oxygen administration by mask (procedure), Placing subject in prone position (procedure), Oxygen administration by mask (procedure), Placing subject in prone position (procedure), Oxygen administration by mask (procedure), Placing subject in prone position (procedure), Oxygen administration by mask (procedure), Placing subject in prone position (procedure)"
a4812da2-32b2-471e-967a-42ee883a0963,F,white,"Body mass index 30+ - obesity (finding), Hypertension, Miscarriage in first trimester, Headache (finding), Cough (finding), Sore throat symptom (finding), Fatigue (finding), Dyspnea (finding), Wheezing (finding), Fever (finding), Suspected COVID-19, COVID-19, Pneumonia (disorder), Hypoxemia (disorder), Respiratory distress (finding), Acute deep venous thrombosis (disorder)","Atenolol 50 MG / Chlorthalidone 25 MG Oral Tablet, Atenolol 50 MG / Chlorthalidone 25 MG Oral Tablet, Atenolol 50 MG / Chlorthalidone 25 MG Oral Tablet, Atenolol 50 MG / Chlorthalidone 25 MG Oral Tablet, 0.4 ML Enoxaparin sodium 100 MG/ML Prefilled Syringe, NDA020503 200 ACTUAT Albuterol 0.09 MG/ACTUAT Metered Dose Inhaler, Acetaminophen 500 MG Oral Tablet, 1 ML Enoxaparin sodium 150 MG/ML Prefilled Syringe","Face mask (physical object), Plain chest X-ray (procedure), Oxygen administration by mask (procedure), Placing subject in prone position (procedure), Oxygen administration by mask (procedure), Placing subject in prone position (procedure), Oxygen administration by mask (procedure), Placing subject in prone position (procedure), Oxygen administration by mask (procedure), Placing subject in prone position (procedure), Oxygen administration by mask (procedure), Placing subject in prone position (procedure), Oxygen administration by mask (procedure), Placing subject in prone position (procedure), Oxygen administration by mask (procedure), Placing subject in prone position (procedure), Oxygen administration by mask (procedure), Placing subject in prone position (procedure), Oxygen administration by mask (procedure), Placing subject in prone position (procedure), Oxygen administration by mask (procedure), Placing subject in prone position (procedure), Oxygen administration by mask (procedure), Oxygen administration by mask (procedure), Oxygen administration by mask (procedure), Oxygen administration by mask (procedure)"
7bfb0201-fdbb-4846-9db0-2653e9d01ebf,F,white,"Body mass index 30+ - obesity (finding), Osteoarthritis of knee, Prediabetes, Anemia (disorder), Chronic sinusitis (disorder), Sprain of ankle, Headache (finding), Cough (finding), Sore throat symptom (finding), Fatigue (finding), Dyspnea (finding), Wheezing (finding), Loss of taste (finding), Suspected COVID-19, COVID-19","Vitamin B 12 5 MG/ML Injectable Solution, Acetaminophen 325 MG Oral Tablet","Colonoscopy, Face mask (physical object), Medication Reconciliation (procedure)"
90205915-594b-41d1-a888-82a29a38fffa,M,white,"Diabetes, Anemia (disorder), Hypertension, Hypertriglyceridemia (disorder), Metabolic syndrome X (disorder), Chronic sinusitis (disorder), Sore throat symptom (finding), Sputum finding (finding), Muscle pain (finding), Joint pain (finding), Chill (finding), Fever (finding), Loss of taste (finding), Suspected COVID-19, COVID-19","Atenolol 50 MG / Chlorthalidone 25 MG Oral Tablet, Atenolol 50 MG / Chlorthalidone 25 MG Oral Tablet, Atenolol 50 MG / Chlorthalidone 25 MG Oral Tablet, Atenolol 50 MG / Chlorthalidone 25 MG Oral Tablet, Atenolol 50 MG / Chlorthalidone 25 MG Oral Tablet, Atenolol 50 MG / Chlorthalidone 25 MG Oral Tablet, Atenolol 50 MG / Chlorthalidone 25 MG Oral Tablet, Atenolol 50 MG / Chlorthalidone 25 MG Oral Tablet, Atenolol 50 MG / Chlorthalidone 25 MG Oral Tablet, Atenolol 50 MG / Chlorthalidone 25 MG Oral Tablet, Atenolol 50 MG / Chlorthalidone 25 MG Oral Tablet, Atenolol 50 MG / Chlorthalidone 25 MG Oral Tablet, Atenolol 50 MG / Chlorthalidone 25 MG Oral Tablet, Atenolol 50 MG / Chlorthalidone 25 MG Oral Tablet, Atenolol 50 MG / Chlorthalidone 25 MG Oral Tablet, Atenolol 50 MG / Chlorthalidone 25 MG Oral Tablet, Atenolol 50 MG / Chlorthalidone 25 MG Oral Tablet, Atenolol 50 MG / Chlorthalidone 25 MG Oral Tablet",Face mask (physical object)
616e5019-d4bf-46d7-805a-baff99a270d6,F,asian,"Body mass index 30+ - obesity (finding), Chronic sinusitis (disorder), Normal pregnancy, Preeclampsia, Viral sinusitis (disorder), Cough (finding), Sore throat symptom (finding), Chill (finding), Fever (finding), Loss of taste (finding), Suspected COVID-19, COVID-19","Terfenadine 60 MG Oral Tablet, NDA020800 0.3 ML Epinephrine 1 MG/ML Auto-Injector, Amoxicillin 250 MG / Clavulanate 125 MG Oral Tablet","Hemoglobin / Hematocrit / Platelet count, Vaccination for diphtheria  pertussis  and tetanus, Urine screening for glucose, Evaluation of uterine fundal height, Auscultation of the fetal heart, Evaluation of uterine fundal height, Auscultation of the fetal heart, Streptococcus pneumoniae group B antigen test, Evaluation of uterine fundal height, Auscultation of the fetal heart, Evaluation of uterine fundal height, Auscultation of the fetal heart, Episiotomy, Childbirth, Physical examination following birth, Depression screening, Face mask (physical object)"
8f73b821-ffaa-4e3c-b33e-dc5a04eca167,M,white,"Body mass index 30+ - obesity (finding), Localized  primary osteoarthritis of the hand, Chronic sinusitis (disorder), Viral sinusitis (disorder), Concussion with no loss of consciousness, Cough (finding), Sputum finding (finding), Fever (finding), Suspected COVID-19, COVID-19","Naproxen sodium 220 MG Oral Tablet, Naproxen sodium 220 MG Oral Tablet, Naproxen sodium 220 MG Oral Tablet","Medication Reconciliation (procedure), Face mask (physical object)"
