patient_id,gender,race,conditions,medications,procedures
e01f1215-ad82-4281-b8ec-b7c9beac4536,M,black,"Body mass index 30+ - obesity (finding), Coronary Heart Disease, Osteoporosis (disorder)","Clopidogrel 75 MG Oral Tablet, Simvastatin 20 MG Oral Tablet, Amlodipine 5 MG Oral Tablet, Nitroglycerin 0.4 MG/ACTUAT Mucosal Spray, Clopidogrel 75 MG Oral Tablet, Nitroglycerin 0.4 MG/ACTUAT Mucosal Spray, Simvastatin 20 MG Oral Tablet, Amlodipine 5 MG Oral Tablet, Alendronic acid 10 MG Oral Tablet, Clopidogrel 75 MG Oral Tablet, Nitroglycerin 0.4 MG/ACTUAT Mucosal Spray, Simvastatin 20 MG Oral Tablet, Amlodipine 5 MG Oral Tablet, Clopidogrel 75 MG Oral Tablet, Nitroglycerin 0.4 MG/ACTUAT Mucosal Spray, Simvastatin 20 MG Oral Tablet, Amlodipine 5 MG Oral Tablet, Clopidogrel 75 MG Oral Tablet, Nitroglycerin 0.4 MG/ACTUAT Mucosal Spray, Simvastatin 20 MG Oral Tablet, Amlodipine 5 MG Oral Tablet, Clopidogrel 75 MG Oral Tablet, Nitroglycerin 0.4 MG/ACTUAT Mucosal Spray, Simvastatin 20 MG Oral Tablet, Amlodipine 5 MG Oral Tablet, Clopidogrel 75 MG Oral Tablet, Nitroglycerin 0.4 MG/ACTUAT Mucosal Spray, Simvastatin 20 MG Oral Tablet, Amlodipine 5 MG Oral Tablet, Clopidogrel 75 MG Oral Tablet, Nitroglycerin 0.4 MG/ACTUAT Mucosal Spray, Simvastatin 20 MG Oral Tablet, Amlodipine 5 MG Oral Tablet, Clopidogrel 75 MG Oral Tablet, Nitroglycerin 0.4 MG/ACTUAT Mucosal Spray, Simvastatin 20 MG Oral Tablet, Amlodipine 5 MG Oral Tablet, Clopidogrel 75 MG Oral Tablet, Nitroglycerin 0.4 MG/ACTUAT Mucosal Spray, Simvastatin 20 MG Oral Tablet, Amlodipine 5 MG Oral Tablet",Medication Reconciliation (procedure)
8dfe1ae6-88b6-46a6-bf1c-3013f7e44c0d,F,white,"Chronic sinusitis (disorder), Body mass index 30+ - obesity (finding), Chronic pain, Prediabetes, Diabetes, Hyperglycemia (disorder), Hypertriglyceridemia (disorder), Metabolic syndrome X (disorder), Neuropathy due to type 2 diabetes mellitus (disorder), Cough (finding), Fatigue (finding), Fever (finding), Loss of taste (finding), Suspected COVID-19, COVID-19","24 HR Metformin hydrochloride 500 MG Extended Release Oral Tablet, 24 HR Metformin hydrochloride 500 MG Extended Release Oral Tablet, 24 HR Metformin hydrochloride 500 MG Extended Release Oral Tablet, 24 HR Metformin hydrochloride 500 MG Extended Release Oral Tablet, 24 HR Metformin hydrochloride 500 MG Extended Release Oral Tablet, 24 HR Metformin hydrochloride 500 MG Extended Release Oral Tablet, 24 HR Metformin hydrochloride 500 MG Extended Release Oral Tablet, 24 HR Metformin hydrochloride 500 MG Extended Release Oral Tablet, 24 HR Metformin hydrochloride 500 MG Extended Release Oral Tablet, 24 HR Metformin hydrochloride 500 MG Extended Release Oral Tablet, 24 HR Metformin hydrochloride 500 MG Extended Release Oral Tablet, 24 HR Metformin hydrochloride 500 MG Extended Release Oral Tablet, 24 HR Metformin hydrochloride 500 MG Extended Release Oral Tablet, 24 HR Metformin hydrochloride 500 MG Extended Release Oral Tablet, 24 HR Metformin hydrochloride 500 MG Extended Release Oral Tablet, 24 HR Metformin hydrochloride 500 MG Extended Release Oral Tablet","Face mask (physical object), Colonoscopy"
d9ea1abc-9b19-4c5f-8917-83b3628d94e0,F,white,"Miscarriage in first trimester, Tubal pregnancy, Acute bronchitis (disorder), Normal pregnancy, Preeclampsia, Cough (finding), Sputum finding (finding), Fatigue (finding), Fever (finding), Loss of taste (finding), Suspected COVID-19, COVID-19","Acetaminophen 21.7 MG/ML / Dextromethorphan Hydrobromide 1 MG/ML / doxylamine succinate 0.417 MG/ML Oral Solution, Errin 28 Day Pack","Standard pregnancy test, Ultrasound scan for fetal viability, Evaluation of uterine fundal height, Auscultation of the fetal heart, Blood typing  RH typing, Hemoglobin / Hematocrit / Platelet count, Hepatitis B Surface Antigen Measurement, Human immunodeficiency virus antigen test, Chlamydia antigen test, Gonorrhea infection test, Syphilis infection test, Urine culture, Cytopathology procedure  preparation of smear  genital source, Urine screening test for diabetes, Hepatitis C antibody test, Rubella screening, Measurement of Varicella-zoster virus antibody, Skin test for tuberculosis, Urine protein test, Physical examination of mother, Evaluation of uterine fundal height, Auscultation of the fetal heart, Screening for chromosomal aneuploidy in prenatal amniotic fluid, Fetal anatomy study, Alpha-fetoprotein test, Evaluation of uterine fundal height, Auscultation of the fetal heart, Evaluation of uterine fundal height, Auscultation of the fetal heart, Evaluation of uterine fundal height, Auscultation of the fetal heart, Hemoglobin / Hematocrit / Platelet count, Vaccination for diphtheria  pertussis  and tetanus, Urine screening for glucose, Evaluation of uterine fundal height, Auscultation of the fetal heart, Evaluation of uterine fundal height, Auscultation of the fetal heart, Streptococcus pneumoniae group B antigen test, Evaluation of uterine fundal height, Auscultation of the fetal heart, Evaluation of uterine fundal height, Auscultation of the fetal heart, Evaluation of uterine fundal height, Auscultation of the fetal heart, Epidural anesthesia, Childbirth, Face mask (physical object), Physical examination following birth, Depression screening"
7e407936-dee5-44ee-93a1-5715dfd9cc1a,M,white,"Cough (finding), Sore throat symptom (finding), Sputum finding (finding), Fatigue (finding), Fever (finding), Loss of taste (finding), Suspected COVID-19, COVID-19, Pneumonia (disorder), Hypoxemia (disorder), Respiratory distress (finding)","0.4 ML Enoxaparin sodium 100 MG/ML Prefilled Syringe, Acetaminophen 500 MG Oral Tablet","Face mask (physical object), Plain chest X-ray (procedure), Oxygen administration by mask (procedure), Placing subject in prone position (procedure), Oxygen administration by mask (procedure), Placing subject in prone position (procedure), Oxygen administration by mask (procedure), Placing subject in prone position (procedure), Oxygen administration by mask (procedure), Placing subject in prone position (procedure), Oxygen administration by mask (procedure), Placing subject in prone position (procedure), Oxygen administration by mask (procedure), Placing subject in prone position (procedure), Oxygen administration by mask (procedure), Placing subject in prone position (procedure), Oxygen administration by mask (procedure), Placing subject in prone position (procedure), Oxygen administration by mask (procedure), Placing subject in prone position (procedure)"
a3f6fcea-a6f1-480a-82d8-09148f01397b,M,white,"Chronic pain, Impacted molars, Chronic intractable migraine without aura, Body mass index 30+ - obesity (finding), Prediabetes, Anemia (disorder), Drug overdose, Headache (finding), Cough (finding), Fatigue (finding), Fever (finding), Suspected COVID-19, COVID-19, Pneumonia (disorder), Hypoxemia (disorder), Respiratory distress (finding)","0.4 ML Enoxaparin sodium 100 MG/ML Prefilled Syringe, Acetaminophen 500 MG Oral Tablet","Medication Reconciliation (procedure), Face mask (physical object), Plain chest X-ray (procedure), Oxygen administration by mask (procedure), Placing subject in prone position (procedure), Oxygen administration by mask (procedure), Placing subject in prone position (procedure), Oxygen administration by mask (procedure), Placing subject in prone position (procedure), Oxygen administration by mask (procedure), Placing subject in prone position (procedure), Oxygen administration by mask (procedure), Placing subject in prone position (procedure), Oxygen administration by mask (procedure), Placing subject in prone position (procedure), Oxygen administration by mask (procedure), Placing subject in prone position (procedure), Oxygen administration by mask (procedure), Placing subject in prone position (procedure), Oxygen administration by mask (procedure), Placing subject in prone position (procedure), Oxygen administration by mask (procedure), Placing subject in prone position (procedure), Oxygen administration by mask (procedure), Placing subject in prone position (procedure), Colonoscopy"
3c777979-2fae-4dc6-8cd2-34c670d7da98,F,white,"Prediabetes, Acute viral pharyngitis (disorder), Headache (finding), Cough (finding), Muscle pain (finding), Joint pain (finding), Fever (finding), Suspected COVID-19, COVID-19","Vitamin B 12 5 MG/ML Injectable Solution, Etonogestrel 68 MG Drug Implant, Seasonique 91 Day Pack, Etonogestrel 68 MG Drug Implant","Insertion of subcutaneous contraceptive, Face mask (physical object)"
9b88e851-51c6-4419-814f-04eec97132d8,M,white,"Chronic sinusitis (disorder), Body mass index 30+ - obesity (finding), Atrial Fibrillation, Osteoarthritis of knee, Sputum finding (finding), Fatigue (finding), Chill (finding), Fever (finding), Loss of taste (finding), Suspected COVID-19, COVID-19, Pneumonia (disorder), Hypoxemia (disorder), Respiratory distress (finding), Sepsis caused by virus (disorder), Acquired coagulation disorder (disorder), Acute bronchitis (disorder)","Warfarin Sodium 5 MG Oral Tablet, Verapamil Hydrochloride 40 MG, Digoxin 0.125 MG Oral Tablet, Verapamil Hydrochloride 40 MG, Digoxin 0.125 MG Oral Tablet, Warfarin Sodium 5 MG Oral Tablet, Naproxen sodium 220 MG Oral Tablet, Verapamil Hydrochloride 40 MG, Digoxin 0.125 MG Oral Tablet, Warfarin Sodium 5 MG Oral Tablet, Verapamil Hydrochloride 40 MG, Digoxin 0.125 MG Oral Tablet, Warfarin Sodium 5 MG Oral Tablet, Verapamil Hydrochloride 40 MG, Digoxin 0.125 MG Oral Tablet, Warfarin Sodium 5 MG Oral Tablet, Verapamil Hydrochloride 40 MG, Digoxin 0.125 MG Oral Tablet, Warfarin Sodium 5 MG Oral Tablet, Verapamil Hydrochloride 40 MG, Digoxin 0.125 MG Oral Tablet, Warfarin Sodium 5 MG Oral Tablet, Verapamil Hydrochloride 40 MG, Digoxin 0.125 MG Oral Tablet, Warfarin Sodium 5 MG Oral Tablet, Verapamil Hydrochloride 40 MG, Digoxin 0.125 MG Oral Tablet, Warfarin Sodium 5 MG Oral Tablet, Verapamil Hydrochloride 40 MG, Digoxin 0.125 MG Oral Tablet, Warfarin Sodium 5 MG Oral Tablet, 0.4 ML Enoxaparin sodium 100 MG/ML Prefilled Syringe, Acetaminophen 500 MG Oral Tablet, Verapamil Hydrochloride 40 MG, Digoxin 0.125 MG Oral Tablet, Warfarin Sodium 5 MG Oral Tablet, Acetaminophen 325 MG Oral Tablet, Verapamil Hydrochloride 40 MG, Digoxin 0.125 MG Oral Tablet, Warfarin Sodium 5 MG Oral Tablet","Electrical cardioversion, Face mask (physical object), Plain chest X-ray (procedure), Oxygen administration by mask (procedure), Placing subject in prone position (procedure), Oxygen administration by mask (procedure), Placing subject in prone position (procedure), Oxygen administration by mask (procedure), Placing subject in prone position (procedure), Electrical cardioversion, Oxygen administration by mask (procedure), Placing subject in prone position (procedure), Oxygen administration by mask (procedure), Placing subject in prone position (procedure), Oxygen administration by mask (procedure), Placing subject in prone position (procedure), Oxygen administration by mask (procedure), Placing subject in prone position (procedure), Oxygen administration by mask (procedure), Placing subject in prone position (procedure), Oxygen administration by mask (procedure), Placing subject in prone position (procedure), Oxygen administration by mask (procedure), Oxygen administration by mask (procedure), Oxygen administration by mask (procedure), Oxygen administration by mask (procedure), Oxygen administration by mask (procedure)"
c6ffc987-05c5-45ae-b5e7-5123400dfc05,F,white,"Hypertension, Miscarriage in first trimester, Chill (finding), Fever (finding), Suspected COVID-19, COVID-19, Pneumonia (disorder), Hypoxemia (disorder), Respiratory distress (finding), Acute respiratory failure (disorder), Sepsis caused by virus (disorder), Acute pulmonary embolism (disorder)","Atenolol 50 MG / Chlorthalidone 25 MG Oral Tablet, Atenolol 50 MG / Chlorthalidone 25 MG Oral Tablet, Atenolol 50 MG / Chlorthalidone 25 MG Oral Tablet, Atenolol 50 MG / Chlorthalidone 25 MG Oral Tablet, Atenolol 50 MG / Chlorthalidone 25 MG Oral Tablet, Atenolol 50 MG / Chlorthalidone 25 MG Oral Tablet, Atenolol 50 MG / Chlorthalidone 25 MG Oral Tablet, Atenolol 50 MG / Chlorthalidone 25 MG Oral Tablet, Atenolol 50 MG / Chlorthalidone 25 MG Oral Tablet, Atenolol 50 MG / Chlorthalidone 25 MG Oral Tablet, Atenolol 50 MG / Chlorthalidone 25 MG Oral Tablet, Atenolol 50 MG / Chlorthalidone 25 MG Oral Tablet, Atenolol 50 MG / Chlorthalidone 25 MG Oral Tablet, Atenolol 50 MG / Chlorthalidone 25 MG Oral Tablet, Atenolol 50 MG / Chlorthalidone 25 MG Oral Tablet, Atenolol 50 MG / Chlorthalidone 25 MG Oral Tablet, Atenolol 50 MG / Chlorthalidone 25 MG Oral Tablet, 0.4 ML Enoxaparin sodium 100 MG/ML Prefilled Syringe, Acetaminophen 500 MG Oral Tablet, 1 ML Enoxaparin sodium 150 MG/ML Prefilled Syringe","Medication Reconciliation (procedure), Face mask (physical object), Plain chest X-ray (procedure), Oxygen administration by mask (procedure), Placing subject in prone position (procedure), Oxygen administration by mask (procedure), Placing subject in prone position (procedure), Oxygen administration by mask (procedure), Placing subject in prone position (procedure), Oxygen administration by mask (procedure), Placing subject in prone position (procedure), Oxygen administration by mask (procedure), Placing subject in prone position (procedure), Oxygen administration by mask (procedure), Placing subject in prone position (procedure), Oxygen administration by mask (procedure), Placing subject in prone position (procedure), Oxygen administration by mask (procedure), Placing subject in prone position (procedure), Oxygen administration by mask (procedure), Placing subject in prone position (procedure), Oxygen administration by mask (procedure), Placing subject in prone position (procedure), Oxygen administration by mask (procedure), Placing subject in prone position (procedure), Oxygen administration by mask (procedure), Placing subject in prone position (procedure)"
55e4043d-c49d-4d65-99c2-62726005acec,F,asian,,1 ML medroxyPROGESTERone acetate 150 MG/ML Injection,"Intramuscular injection, Intramuscular injection, Intramuscular injection, Intramuscular injection"
273aa188-23e0-48a1-9ac6-f0366409fab6,F,white,"Cough (finding), Fatigue (finding), Dyspnea (finding), Wheezing (finding), Loss of taste (finding), Suspected COVID-19, COVID-19",,"Medication Reconciliation (procedure), Face mask (physical object)"
21eb8cc4-4cb4-4c4a-8fad-999b290c06bb,M,white,"Cough (finding), Fever (finding), Suspected COVID-19, COVID-19",,Face mask (physical object)
ffa1c768-fbd0-452e-97cb-5f95b0a68ee8,F,white,"Perennial allergic rhinitis, Hypertension, Miscarriage in first trimester, Rupture of appendix, Appendicitis, History of appendectomy, Normal pregnancy","diphenhydrAMINE Hydrochloride 25 MG Oral Tablet, NDA020800 0.3 ML Epinephrine 1 MG/ML Auto-Injector, Hydrochlorothiazide 25 MG Oral Tablet, Hydrochlorothiazide 25 MG Oral Tablet, Hydrochlorothiazide 25 MG Oral Tablet, Hydrochlorothiazide 25 MG Oral Tablet, Hydrochlorothiazide 25 MG Oral Tablet, Hydrochlorothiazide 25 MG Oral Tablet, Hydrochlorothiazide 25 MG Oral Tablet, Hydrochlorothiazide 25 MG Oral Tablet, Hydrochlorothiazide 25 MG Oral Tablet, Hydrochlorothiazide 25 MG Oral Tablet, Hydrochlorothiazide 25 MG Oral Tablet, Hydrochlorothiazide 25 MG Oral Tablet, Hydrochlorothiazide 25 MG Oral Tablet, Hydrochlorothiazide 25 MG Oral Tablet, Hydrochlorothiazide 25 MG Oral Tablet, Hydrochlorothiazide 25 MG Oral Tablet, Hydrochlorothiazide 25 MG Oral Tablet, Hydrochlorothiazide 25 MG Oral Tablet, Hydrochlorothiazide 25 MG Oral Tablet","Appendectomy, Standard pregnancy test, Ultrasound scan for fetal viability, Evaluation of uterine fundal height, Auscultation of the fetal heart, Blood typing  RH typing, Hemoglobin / Hematocrit / Platelet count, Hepatitis B Surface Antigen Measurement, Human immunodeficiency virus antigen test, Chlamydia antigen test, Gonorrhea infection test, Syphilis infection test, Urine culture, Cytopathology procedure  preparation of smear  genital source, Urine screening test for diabetes, Hepatitis C antibody test, Rubella screening, Measurement of Varicella-zoster virus antibody, Skin test for tuberculosis, Urine protein test, Physical examination of mother, Evaluation of uterine fundal height, Auscultation of the fetal heart, Screening for chromosomal aneuploidy in prenatal amniotic fluid, Fetal anatomy study, Alpha-fetoprotein test, Evaluation of uterine fundal height, Auscultation of the fetal heart, Evaluation of uterine fundal height, Auscultation of the fetal heart, Evaluation of uterine fundal height, Auscultation of the fetal heart, Hemoglobin / Hematocrit / Platelet count, Vaccination for diphtheria  pertussis  and tetanus, Urine screening for glucose, Evaluation of uterine fundal height, Auscultation of the fetal heart, Evaluation of uterine fundal height, Auscultation of the fetal heart, Streptococcus pneumoniae group B antigen test, Evaluation of uterine fundal height, Auscultation of the fetal heart, Evaluation of uterine fundal height, Auscultation of the fetal heart, Evaluation of uterine fundal height, Auscultation of the fetal heart, Evaluation of uterine fundal height, Auscultation of the fetal heart, Medical induction of labor, Cesarean section"
22df948d-0e5c-44a8-b0e6-75ef5c49bb92,M,white,"Headache (finding), Cough (finding), Fever (finding), Loss of taste (finding), Suspected COVID-19, COVID-19",,"Medication Reconciliation (procedure), Face mask (physical object)"
498fb766-9084-4123-b242-30e2b1cbb75b,M,white,"Cough (finding), Fatigue (finding), Nausea (finding), Vomiting symptom (finding), Loss of taste (finding), Suspected COVID-19, COVID-19, Acute viral pharyngitis (disorder)",,"Medication Reconciliation (procedure), Medication Reconciliation (procedure), Face mask (physical object), Throat culture (procedure)"
52173698-16d3-4b68-9dc3-f8c61082b227,M,white,"Chronic sinusitis (disorder), Childhood asthma, Sputum finding (finding), Dyspnea (finding), Wheezing (finding), Nausea (finding), Vomiting symptom (finding), Fever (finding), Suspected COVID-19, COVID-19, Acute bronchitis (disorder)","120 ACTUAT Fluticasone propionate 0.044 MG/ACTUAT Metered Dose Inhaler, NDA020503 200 ACTUAT Albuterol 0.09 MG/ACTUAT Metered Dose Inhaler, 120 ACTUAT Fluticasone propionate 0.044 MG/ACTUAT Metered Dose Inhaler, NDA020503 200 ACTUAT Albuterol 0.09 MG/ACTUAT Metered Dose Inhaler, 120 ACTUAT Fluticasone propionate 0.044 MG/ACTUAT Metered Dose Inhaler, NDA020503 200 ACTUAT Albuterol 0.09 MG/ACTUAT Metered Dose Inhaler, 120 ACTUAT Fluticasone propionate 0.044 MG/ACTUAT Metered Dose Inhaler, NDA020503 200 ACTUAT Albuterol 0.09 MG/ACTUAT Metered Dose Inhaler, 120 ACTUAT Fluticasone propionate 0.044 MG/ACTUAT Metered Dose Inhaler, NDA020503 200 ACTUAT Albuterol 0.09 MG/ACTUAT Metered Dose Inhaler, 120 ACTUAT Fluticasone propionate 0.044 MG/ACTUAT Metered Dose Inhaler, NDA020503 200 ACTUAT Albuterol 0.09 MG/ACTUAT Metered Dose Inhaler, Acetaminophen 325 MG Oral Tablet","Medication Reconciliation (procedure), Face mask (physical object)"
64861ef0-310b-44f1-afa8-f34a01b05209,F,white,"Chronic sinusitis (disorder), Cough (finding), Sputum finding (finding), Loss of taste (finding), Suspected COVID-19, COVID-19","Hydrocortisone 10 MG/ML Topical Cream, Fexofenadine hydrochloride 60 MG Oral Tablet, NDA020800 0.3 ML Epinephrine 1 MG/ML Auto-Injector, Camila 28 Day Pack",Face mask (physical object)
28e8f58a-0cd6-4e15-8557-90e9afb80663,M,white,"Viral sinusitis (disorder), Acute viral pharyngitis (disorder), Cough (finding), Sputum finding (finding), Fatigue (finding), Chill (finding), Suspected COVID-19, COVID-19",Amoxicillin 250 MG / Clavulanate 125 MG Oral Tablet,"Throat culture (procedure), Face mask (physical object), Medication Reconciliation (procedure)"
de85d733-9d7f-4526-b708-5028623145b5,M,white,"Atopic dermatitis, Perennial allergic rhinitis with seasonal variation, Concussion injury of brain, Headache (finding), Sputum finding (finding), Fever (finding), Loss of taste (finding), Suspected COVID-19, COVID-19","Loratadine 5 MG Chewable Tablet, NDA020800 0.3 ML Epinephrine 1 MG/ML Auto-Injector",Face mask (physical object)
36e03bde-5661-4c1a-bd4d-9a4f8f188882,F,black,"Hypertension, Miscarriage in first trimester, Headache (finding), Fatigue (finding), Fever (finding), Loss of taste (finding), Suspected COVID-19, COVID-19, Acute bronchitis (disorder)","Atenolol 50 MG / Chlorthalidone 25 MG Oral Tablet, Atenolol 50 MG / Chlorthalidone 25 MG Oral Tablet, Atenolol 50 MG / Chlorthalidone 25 MG Oral Tablet, Atenolol 50 MG / Chlorthalidone 25 MG Oral Tablet, Atenolol 50 MG / Chlorthalidone 25 MG Oral Tablet, Atenolol 50 MG / Chlorthalidone 25 MG Oral Tablet, Atenolol 50 MG / Chlorthalidone 25 MG Oral Tablet, Atenolol 50 MG / Chlorthalidone 25 MG Oral Tablet, Atenolol 50 MG / Chlorthalidone 25 MG Oral Tablet, Atenolol 50 MG / Chlorthalidone 25 MG Oral Tablet, Acetaminophen 325 MG Oral Tablet","Insertion of intrauterine contraceptive device, Face mask (physical object), Measurement of respiratory function (procedure)"
4f7e5fd0-6cda-41f3-bcb4-f16a25ecc671,F,white,"Headache (finding), Cough (finding), Sputum finding (finding), Fatigue (finding), Fever (finding), Suspected COVID-19, COVID-19","Loratadine 5 MG Chewable Tablet, NDA020800 0.3 ML Epinephrine 1 MG/ML Auto-Injector","Allergy screening test, Medication Reconciliation (procedure), Face mask (physical object), Medication Reconciliation (procedure)"
2bc387b0-ef43-4fef-b34a-5260447de379,M,white,"Prediabetes, Anemia (disorder), Hyperlipidemia, Cough (finding), Sputum finding (finding), Fever (finding), Loss of taste (finding), Suspected COVID-19, COVID-19","Simvastatin 10 MG Oral Tablet, Simvastatin 10 MG Oral Tablet, Simvastatin 10 MG Oral Tablet, Simvastatin 10 MG Oral Tablet, Simvastatin 10 MG Oral Tablet, Simvastatin 10 MG Oral Tablet, Simvastatin 10 MG Oral Tablet, Simvastatin 10 MG Oral Tablet, Simvastatin 10 MG Oral Tablet, Simvastatin 10 MG Oral Tablet, Simvastatin 10 MG Oral Tablet, Simvastatin 10 MG Oral Tablet, Simvastatin 10 MG Oral Tablet, Simvastatin 10 MG Oral Tablet, Simvastatin 10 MG Oral Tablet, Simvastatin 10 MG Oral Tablet, Simvastatin 10 MG Oral Tablet, Simvastatin 10 MG Oral Tablet, Simvastatin 10 MG Oral Tablet","Digital examination of rectum, Medication Reconciliation (procedure), Face mask (physical object)"
84ee4a88-a51c-483b-ad57-a4afc9d1e9e5,F,white,"Hypertension, Normal pregnancy, Preeclampsia, Escherichia coli urinary tract infection, Cough (finding), Suspected COVID-19, COVID-19","Hydrochlorothiazide 12.5 MG, Hydrochlorothiazide 12.5 MG, Hydrochlorothiazide 12.5 MG, Hydrochlorothiazide 12.5 MG, Hydrochlorothiazide 12.5 MG, Nitrofurantoin 5 MG/ML Oral Suspension, Phenazopyridine hydrochloride 100 MG Oral Tablet, Hydrochlorothiazide 12.5 MG","Streptococcus pneumoniae group B antigen test, Evaluation of uterine fundal height, Auscultation of the fetal heart, Medical induction of labor, Childbirth, RhD passive immunization, Physical examination following birth, Depression screening, Face mask (physical object)"
691c092b-e2dd-4a85-9823-b73156b9d864,M,white,"Hypertension, Prediabetes, Anemia (disorder), Cough (finding), Fever (finding), Loss of taste (finding), Suspected COVID-19, COVID-19","Hydrochlorothiazide 25 MG Oral Tablet, Hydrochlorothiazide 25 MG Oral Tablet, Hydrochlorothiazide 25 MG Oral Tablet, Hydrochlorothiazide 25 MG Oral Tablet, Hydrochlorothiazide 25 MG Oral Tablet, Hydrochlorothiazide 25 MG Oral Tablet, Hydrochlorothiazide 25 MG Oral Tablet, Hydrochlorothiazide 25 MG Oral Tablet, Hydrochlorothiazide 25 MG Oral Tablet, Hydrochlorothiazide 25 MG Oral Tablet, Hydrochlorothiazide 25 MG Oral Tablet, Hydrochlorothiazide 25 MG Oral Tablet, Hydrochlorothiazide 25 MG Oral Tablet, Hydrochlorothiazide 25 MG Oral Tablet, Hydrochlorothiazide 25 MG Oral Tablet, Hydrochlorothiazide 25 MG Oral Tablet, Hydrochlorothiazide 25 MG Oral Tablet, Hydrochlorothiazide 25 MG Oral Tablet, Hydrochlorothiazide 25 MG Oral Tablet, Hydrochlorothiazide 25 MG Oral Tablet, Hydrochlorothiazide 25 MG Oral Tablet, Hydrochlorothiazide 25 MG Oral Tablet, Hydrochlorothiazide 25 MG Oral Tablet, Hydrochlorothiazide 25 MG Oral Tablet, Hydrochlorothiazide 25 MG Oral Tablet, Hydrochlorothiazide 25 MG Oral Tablet, Hydrochlorothiazide 25 MG Oral Tablet, Hydrochlorothiazide 25 MG Oral Tablet, Vitamin B 12 5 MG/ML Injectable Solution, Hydrochlorothiazide 25 MG Oral Tablet","Peripheral blood smear interpretation, Review of systems (procedure), Medication Reconciliation (procedure), Brief general examination (procedure), Face mask (physical object)"
